{
  "source_url": "https://finalfantasy.fandom.com/wiki/Feral_Link",
  "slug": "black-hole",
  "name": "Black Hole",
  "role": "Commando",
  "monster": {
    "name": "Meonekton",
    "slug": "meonekton",
    "source_url": "https://finalfantasy.fandom.com/wiki/Meonekton_(Final_Fantasy_XIII-2)"
  },
  "input": {
    "type": "Button tap",
    "ps3": [
      "X"
    ],
    "xbox": [
      "A"
    ]
  },
  "description": "Inflict magic damage on target and nearby foes and knock them backwards.",
  "details": "Inflicts Deprotect.",
  "type": "Magic",
  "damage_modifier": null,
  "charge_time_seconds": 120,
  "max_sync_pct": 300,
  "effects": []
}