{
  "source_url": "https://finalfantasy.fandom.com/wiki/Feral_Link",
  "slug": "legion-of-one",
  "name": "Legion of One",
  "role": "Commando",
  "monster": {
    "name": "Lightning",
    "slug": "lightning-final-fantasy-xiii",
    "source_url": "https://finalfantasy.fandom.com/wiki/Lightning_(Final_Fantasy_XIII)"
  },
  "input": {
    "type": "Multiple",
    "ps3": [
      "Left stick right"
    ],
    "xbox": [
      "Left stick down",
      "Left stick up",
      "Left stick down",
      "X"
    ]
  },
  "description": "Unleash a devastating flurry of blows. Damage varies by situation.",
  "details": "Damage modifier doubles when staggered.",
  "type": "Other",
  "damage_modifier": null,
  "charge_time_seconds": 205,
  "max_sync_pct": 400,
  "effects": []
}