{
  "source_url": "https://finalfantasy.fandom.com/wiki/Feral_Link",
  "slug": "slurp",
  "name": "Slurp",
  "role": "Commando",
  "monster": {
    "name": "Sarracenia",
    "slug": "sarracenia",
    "source_url": "https://finalfantasy.fandom.com/wiki/Sarracenia"
  },
  "input": {
    "type": "Single button",
    "ps3": [
      "X"
    ],
    "xbox": [
      "A"
    ]
  },
  "description": "Deal physical damage and inflict debuffing ailments.",
  "details": "Inflicts Deprotect.",
  "type": "Debuff",
  "damage_modifier": null,
  "charge_time_seconds": 150,
  "max_sync_pct": 300,
  "effects": []
}