{
  "source_url": "https://finalfantasy.fandom.com/wiki/Feral_Link",
  "slug": "wave-cannon",
  "name": "Wave Cannon",
  "role": "Commando",
  "monster": {
    "name": "Omega",
    "slug": "omega",
    "source_url": "https://finalfantasy.fandom.com/wiki/Omega_(Final_Fantasy_XIII-2)"
  },
  "input": {
    "type": "Multiple",
    "ps3": [
      "Left stick right",
      "Left stick down",
      "Left stick left",
      "X"
    ],
    "xbox": [
      "Left stick right",
      "Left stick down",
      "Left stick left",
      "A"
    ]
  },
  "description": "Inflict magic damage on target and nearby foes.",
  "details": null,
  "type": "Magic",
  "damage_modifier": null,
  "charge_time_seconds": 180,
  "max_sync_pct": 350,
  "effects": []
}