{
  "source_url": "https://finalfantasy.fandom.com/wiki/Feral_Link",
  "slug": "shell-spin",
  "name": "Shell Spin",
  "role": "Commando",
  "monster": {
    "name": "Lucidon",
    "slug": "lucidon",
    "source_url": "https://finalfantasy.fandom.com/wiki/Lucidon_(Final_Fantasy_XIII-2)"
  },
  "input": {
    "type": "Timing",
    "ps3": [
      "Square"
    ],
    "xbox": [
      "X"
    ]
  },
  "description": "Inflict physical damage on target and nearby foes.",
  "details": null,
  "type": "Physical",
  "damage_modifier": null,
  "charge_time_seconds": 135,
  "max_sync_pct": 300,
  "effects": []
}