{
  "source_url": "https://finalfantasy.fandom.com/wiki/Feral_Link",
  "slug": "kweh-kweh",
  "name": "Kweh Kweh",
  "role": "Saboteur",
  "monster": {
    "name": "Black Chocobo",
    "slug": "black-chocobo",
    "source_url": "https://finalfantasy.fandom.com/wiki/Black_Chocobo_(Final_Fantasy_XIII-2)"
  },
  "input": {
    "type": "Button tap",
    "ps3": [
      "X"
    ],
    "xbox": [
      "A"
    ]
  },
  "description": "Inflict magic damage on target and nearby foes.",
  "details": null,
  "type": "Magic",
  "damage_modifier": null,
  "charge_time_seconds": 165,
  "max_sync_pct": 300,
  "effects": []
}