{
  "source_url": "https://finalfantasy.fandom.com/wiki/Feral_Link",
  "slug": "hyper-rescue",
  "name": "Hyper Rescue",
  "role": "Medic",
  "monster": {
    "name": "Flanitor",
    "slug": "flanitor",
    "source_url": "https://finalfantasy.fandom.com/wiki/Flanitor_(Final_Fantasy_XIII-2)"
  },
  "input": {
    "type": "None",
    "ps3": [],
    "xbox": []
  },
  "description": "Restore HP to all allies.",
  "details": null,
  "type": "Recovery",
  "damage_modifier": null,
  "charge_time_seconds": 90,
  "max_sync_pct": 100,
  "effects": []
}