{
  "source_url": "https://finalfantasy.fandom.com/wiki/Feral_Link",
  "slug": "refreshing-rain",
  "name": "Refreshing Rain",
  "role": "Ravager",
  "monster": {
    "name": "Spiceacilian",
    "slug": "spiceacilian",
    "source_url": "https://finalfantasy.fandom.com/wiki/Spiceacilian"
  },
  "input": {
    "type": "None",
    "ps3": [],
    "xbox": []
  },
  "description": "Restore HP to all allies.",
  "details": "Also bestows Regen and Veil.",
  "type": "Recovery",
  "damage_modifier": null,
  "charge_time_seconds": 60,
  "max_sync_pct": 100,
  "effects": []
}