{
  "source_url": "https://finalfantasy.fandom.com/wiki/Feral_Link",
  "slug": "shell-spin",
  "name": "Shell Spin",
  "role": "Sentinel",
  "monster": {
    "name": "Bunkerbeast",
    "slug": "bunkerbeast",
    "source_url": "https://finalfantasy.fandom.com/wiki/Bunkerbeast"
  },
  "input": {
    "type": "Stick rotation",
    "ps3": [
      "Rotate left stick clockwise"
    ],
    "xbox": [
      "Rotate left stick clockwise"
    ]
  },
  "description": "Inflict physical damage on target and nearby foes.",
  "details": null,
  "type": "Physical",
  "damage_modifier": null,
  "charge_time_seconds": 135,
  "max_sync_pct": 300,
  "effects": []
}