{
  "source_url": "https://finalfantasy.fandom.com/wiki/Feral_Link",
  "slug": "hop",
  "name": "Hop",
  "role": "Synergist",
  "monster": {
    "name": "Gigantuar",
    "slug": "gigantuar",
    "source_url": "https://finalfantasy.fandom.com/wiki/Gigantuar_(Final_Fantasy_XIII-2)"
  },
  "input": {
    "type": "Timing",
    "ps3": [
      "Triangle"
    ],
    "xbox": [
      "Square",
      "X",
      "Circle",
      "Y",
      "X",
      "A",
      "B"
    ]
  },
  "description": "Inflict magic damage on target and nearby foes.",
  "details": null,
  "type": "Magic",
  "damage_modifier": null,
  "charge_time_seconds": 90,
  "max_sync_pct": 777,
  "effects": []
}