{
  "source_url": "https://finalfantasy.fandom.com/wiki/Feral_Link",
  "slug": "giant-drop",
  "name": "Giant Drop",
  "role": "Ravager",
  "monster": {
    "name": "Gremlin",
    "slug": "gremlin",
    "source_url": "https://finalfantasy.fandom.com/wiki/Gremlin_(Final_Fantasy_XIII-2)"
  },
  "input": {
    "type": "Single button",
    "ps3": [
      "X"
    ],
    "xbox": [
      "A"
    ]
  },
  "description": "Inflict magic damage on target and nearby foes.",
  "details": "First hit is weak physical attack; second hit is magical.",
  "type": "Magic",
  "damage_modifier": null,
  "charge_time_seconds": 135,
  "max_sync_pct": 300,
  "effects": []
}