{
  "source_url": "https://finalfantasy.fandom.com/wiki/Feral_Link",
  "slug": "mimicking-screech",
  "name": "Mimicking Screech",
  "role": "Synergist",
  "monster": {
    "name": "Microchu",
    "slug": "microchu",
    "source_url": "https://finalfantasy.fandom.com/wiki/Microchu_(Final_Fantasy_XIII-2)"
  },
  "input": {
    "type": "Multiple",
    "ps3": [
      "Circle",
      "Circle",
      "X",
      "Triangle"
    ],
    "xbox": [
      "B",
      "B",
      "A",
      "Y"
    ]
  },
  "description": "Strip enhancement from foe and confer enhancement on ally.",
  "details": "Strikes four times.",
  "type": "Buff",
  "damage_modifier": null,
  "charge_time_seconds": 205,
  "max_sync_pct": 400,
  "effects": []
}