{
  "source_url": "https://finalfantasy.fandom.com/wiki/Feral_Link",
  "slug": "second-nailgun",
  "name": "Second Nailgun",
  "role": "Commando",
  "monster": {
    "name": "Hoplite",
    "slug": "hoplite",
    "source_url": "https://finalfantasy.fandom.com/wiki/Hoplite_(Final_Fantasy_XIII-2)"
  },
  "input": {
    "type": "Multiple",
    "ps3": [
      "Left stick right",
      "Left stick down",
      "Left stick left",
      "Left stick up"
    ],
    "xbox": [
      "Left stick right",
      "Left stick down",
      "Left stick left",
      "Left stick up"
    ]
  },
  "description": "Deal physical damage and launch target into the air.",
  "details": null,
  "type": "Physical",
  "damage_modifier": null,
  "charge_time_seconds": 165,
  "max_sync_pct": 350,
  "effects": []
}