{
  "source_url": "https://finalfantasy.fandom.com/wiki/Feral_Link",
  "slug": "sonic-fangs",
  "name": "Sonic Fangs",
  "role": "Commando",
  "monster": {
    "name": "Uridimmu",
    "slug": "uridimmu",
    "source_url": "https://finalfantasy.fandom.com/wiki/Uridimmu_(Final_Fantasy_XIII-2)"
  },
  "input": {
    "type": "Multiple",
    "ps3": [
      "Left stick left",
      "Left stick left",
      "Left stick right"
    ],
    "xbox": [
      "Left stick left",
      "Left stick left",
      "Left stick right"
    ]
  },
  "description": "Deal physical damage to target.",
  "details": null,
  "type": "Physical",
  "damage_modifier": null,
  "charge_time_seconds": 165,
  "max_sync_pct": 300,
  "effects": []
}