{
  "source_url": "https://finalfantasy.fandom.com/wiki/Feral_Link",
  "slug": "friendly-fire",
  "name": "Friendly Fire",
  "role": "Ravager",
  "monster": {
    "name": "Cloudburst",
    "slug": "cloudburst",
    "source_url": "https://finalfantasy.fandom.com/wiki/Cloudburst"
  },
  "input": {
    "type": "Multiple",
    "ps3": [
      "X",
      "X",
      "Triangle",
      "Circle"
    ],
    "xbox": [
      "A",
      "A",
      "Y",
      "B"
    ]
  },
  "description": "Enhances all allies' attributes.",
  "details": "Restores max HP and bestows Faith, Veil, Vigilance and Enfrost.",
  "type": "Buff",
  "damage_modifier": null,
  "charge_time_seconds": 150,
  "max_sync_pct": 375,
  "effects": [
    "Enfrost"
  ]
}